<?xml version="1.0" encoding="UTF-8"?>
<chapter xmlns="https://bookml.org/ns/1.0"
         xmlns:xsi="http://www.w3.org/2001/XMLSchema-instance"
         xsi:schemaLocation="https://bookml.org/ns/1.0 ../schema/bookml-chapter.xsd"
         bookml-version="1.0"
         id="ch03"
         book-id="carrier-to-yesterday"
         draft="1"
         snapshot-date="2026-03-03T19:47:14+01:00">

  <chapterinfo>
    <chapternumber>3</chapternumber>
    <title>Voyager''s Whisper</title>
  </chapterinfo>

  <section seq="1000">

    <para pid="CH03-P0010" seq="1000" type="normal"
          draft-created="1" draft-modified="1"
          modified-by="ai" modified-date="2026-03-03T19:47:14+01:00">
      Mateo's eyes fluttered open to find his phone's screen glowing like a beacon in the dark. A text message from an unknown number had woken him up at what felt like an ungodly hour, its cryptic words already grating on his nerves: "The stars are aligning, but the constellations are all wrong." Mateo groaned and let his head fall back onto the pillow, wondering who could be behind such a nonsensical message. The words seemed to mock him from the screen, their meaning as elusive as a dream he couldn't quite recall. He tossed his phone aside, letting it clatter on the bedside table, and wondered if today was going to be one of those days where everything made no sense.
    </para>

    <para pid="CH03-P0020" seq="2000" type="normal"
          draft-created="1" draft-modified="1"
          modified-by="ai" modified-date="2026-03-03T19:47:14+01:00">
      Mateo Salas' eyes lingered on the phone screen, the cryptic message seared into his mind like a branding iron. His thoughts swirled with possibilities as he tried to decipher the meaning behind the simple yet ominous words: "They're watching." A shiver ran down his spine as he wondered who could be sending him such a message and why. He glanced around the room, feeling an unsettling sense of vulnerability. The morning sunlight streaming through the window seemed to mock him, its cheeriness at odds with the growing unease in his chest. His fingers drummed against the phone's edge as he pondered the next step – should he try to investigate or ignore it and hope it was just a prank?
    </para>

    <para pid="CH03-P0030" seq="3000" type="normal"
          draft-created="1" draft-modified="1"
          modified-by="ai" modified-date="2026-03-03T19:47:14+01:00">
      Mateo's feet carried him through the familiar streets of Robledo as his mind wandered elsewhere. The morning commute was a blur – the sounds of car horns and chatter from passersby faded into the background as he turned over the cryptic message in his head. His eyes scanned the crowded sidewalks without truly seeing the people around him, their faces nothing more than a sea of strangers. He thought about stopping for a coffee, but the line at the café was already long, so Mateo decided to continue on to work instead, lost in thought as the city awakened around him.
    </para>

    <para pid="CH03-P0040" seq="4000" type="normal"
          draft-created="1" draft-modified="1"
          modified-by="ai" modified-date="2026-03-03T19:47:14+01:00">
      Mateo settled into his chair, the familiar creak of the leather a comforting sound as he booted up his computer. His eyes scanned the room, taking in the hum of machinery and the soft chatter of coworkers starting their day. He focused on his screen, sipping his coffee as he began to sift through the morning's emails. Routine notifications from automated systems and messages from colleagues discussing ongoing projects filled his inbox. Mateo methodically worked through each message, responding where necessary and making mental notes for follow-up tasks. His gaze occasionally strayed to the reports on his secondary monitor, scrolling through lines of code and system logs in search of any anomalies that might require his attention.
    </para>

    <para pid="CH03-P0050" seq="5000" type="normal"
          draft-created="1" draft-modified="1"
          modified-by="ai" modified-date="2026-03-03T19:47:14+01:00">
      Mateo Salas' eyes scanned his emails, his morning routine a well-oiled machine. Coworkers began to filter in, the sound of keyboards clacking and muted conversations filling the room. Javi plopped down beside him, a mischievous glint in his eye. "So, Mateo, how was your weekend?" he asked, his tone dripping with sarcasm. "Did you finally find time to leave your apartment, or did Netflix just release a new season of 'Alone and Unloved' that you couldn't tear yourself away from?" Mateo's lips twitched into a wry smile as he shook his head.
    </para>

    <para pid="CH03-P0060" seq="6000" type="normal"
          draft-created="1" draft-modified="1"
          modified-by="ai" modified-date="2026-03-03T19:47:14+01:00">
      Mateo Salas' eyes refocused on Dr. Celia Baeza as she began to brief him on a new project, her words laced with an air of excitement that piqued his interest. She explained that they had been approached by a prominent tech firm to develop an innovative encryption method using quantum entanglement principles, a concept not entirely new to Mateo but one whose application in this context sparked his curiosity. Dr. Baeza handed him a folder containing preliminary research and schematics, which he flipped through as his mind began to wander to the potential implications of such technology, envisioning possibilities for secure data transmission and the challenges that came with implementing it on a large scale.
    </para>

    <break seq="7500" type="scene"/>

    <para pid="CH03-P0070" seq="7000" type="normal"
          draft-created="1" draft-modified="1"
          modified-by="ai" modified-date="2026-03-03T19:47:14+01:00">
      Mateo Salas' gaze lingered on Dr. Celia Baeza as she concluded her briefing, a faint sense of unease settling in his chest. The innovative encryption method seemed impressive, but something about her tone didn't quite add up – a hesitation in her words, a fleeting glance at the door before refocusing on him. Her eyes sparkled with enthusiasm when discussing the project's potential applications, yet he detected an undercurrent of tension beneath her composed demeanor. Mateo Salas' mind began to spin scenarios: was this merely a high-stakes endeavor or something more? He leaned forward slightly, his fingers drumming against the armrest as he waited for Dr. Baeza to elaborate – or perhaps reveal what she seemed determined to keep hidden.
    </para>

    <para pid="CH03-P0080" seq="8000" type="normal"
          draft-created="1" draft-modified="1"
          modified-by="ai" modified-date="2026-03-03T19:47:14+01:00">
      Mateo pushed open the door to Café Luna and scanned the room for a familiar face. Spotting Zoë's bright smile across the crowded space, he made his way through the tables, exchanging greetings with regulars along the way. As he slid into the chair opposite her, she asked about his morning, and Mateo hesitated before deciding not to mention Dr. Baeza's evasive behavior – it was still just a nagging feeling, after all. Instead, he launched into their weekend plans: an impromptu road trip to the coast, with Zoë behind the wheel and him navigating the winding roads.
    </para>

    <para pid="CH03-P0090" seq="9000" type="normal"
          draft-created="1" draft-modified="1"
          modified-by="ai" modified-date="2026-03-03T19:47:14+01:00">
      Mateo's eyes snapped back to his workstation as the intercom crackled to life, Chief Ortega's voice firm but laced with an undercurrent of tension. "Salas, report to my office immediately." The words hung in the air like a challenge, and Mateo felt a shiver run down his spine. He saved his current task and stood up from his chair, smoothing out his rumpled shirt as he made his way across the room. His colleagues' heads turned towards him, their expressions curious but wary. The fluorescent lights overhead seemed to hum in sync with his racing heart as he walked towards the chief's office, wondering what had triggered this sudden summons. The door loomed before him like a threshold into unknown territory, and Mateo steeled himself for whatever lay ahead.
    </para>

    <para pid="CH03-P0100" seq="10000" type="normal"
          draft-created="1" draft-modified="1"
          modified-by="ai" modified-date="2026-03-03T19:47:14+01:00">
      Chief Ortega's expression turned grave as she leaned back in her chair, steepling her fingers together. The dim fluorescent light above her desk cast an unflattering glow on her features, but Mateo Salas's attention remained fixed on the chief's eyes. They seemed to bore into his very soul, as if searching for any sign of weakness or hesitation. "Mateo," she began, her voice low and measured, "we've received a disturbing report from our IT department." The chief paused, collecting her thoughts before continuing. "It appears there may be a security breach in our system – one that could potentially compromise sensitive information." Mateo's gaze never wavered, his mind racing with the implications of such a breach. The chief's next words hung in the air like a challenge: "I want you to investigate this matter discreetly and report back to me directly."
    </para>

    <para pid="CH03-P0110" seq="11000" type="normal"
          draft-created="1" draft-modified="1"
          modified-by="ai" modified-date="2026-03-03T19:47:14+01:00">